{"$defs":{"result_kind":{"description":"First-class outcomes. SOURCE GAP = witness/carrier unavailable; OMEGA = underdetermined by available evidence; NEGATIVE = test ran and the effect was absent (a finding, not a failure).","enum":["POSITIVE","NEGATIVE","INCONCLUSIVE","SOURCE_GAP","OMEGA"],"type":"string"}},"$id":"https://codex-relay/liber-linteus/resultpacket_schema.json","$schema":"https://json-schema.org/draft/2020-12/schema","description":"ResultPacket: machine-readable output of the Liber Linteus reference pipeline W0 witness -> D0 raw -> D1 skeleton -> D2 scholarly tokenization -> features -> frozen predictions -> null tests -> ResultPacket. SOURCE GAP / OMEGA / NEGATIVE are first-class result kinds, not error states.","properties":{"ledger_ref":{"description":"Frozen transformation ledger commit + file.","properties":{"commit":{"type":"string"},"path":{"type":"string"},"rows":{"type":"integer"}},"required":["commit","path"],"type":"object"},"packet_id":{"type":"string"},"pipeline":{"description":"One entry per stage; every transformation exposes preserved/altered/lost/introduced and provenance (Bridge Completion Protocol).","items":{"properties":{"altered":{"type":"string"},"input_layer":{"type":"string"},"introduced":{"type":"string"},"lost":{"type":"string"},"operation":{"type":"string"},"output_layer":{"type":"string"},"preserved":{"type":"string"},"provenance":{"properties":{"address":{"type":"string"},"commit":{"type":"string"},"ledger_rows":{"items":{"type":"string"},"type":"array"},"witness":{"type":"string"}},"required":["witness","commit"],"type":"object"},"stage":{"enum":["W0","D0","D1","D2","features","predictions","null_tests"],"type":"string"}},"required":["stage","operation","preserved","altered","lost","introduced","provenance"],"type":"object"},"type":"array"},"predictions_evaluated":{"items":{"properties":{"criterion_applied":{"type":"string"},"outcome":{"$ref":"#/$defs/result_kind"},"prediction_id":{"type":"string"}},"required":["prediction_id","outcome","criterion_applied"],"type":"object"},"type":"array"},"produced_at":{"format":"date","type":"string"},"source_commit":{"description":"Discovery commit the predictions were frozen at.","type":"string"},"test_declarations":{"description":"Every inferential test declares its input layer and frozen transformation provenance. Descriptive counts are declared separately and never mixed with inferential results.","items":{"properties":{"alpha":{"type":"number"},"frozen_transform_provenance":{"properties":{"input_layer":{"enum":["D0","D1","D2"],"type":"string"},"ledger_commit":{"type":"string"}},"required":["input_layer","ledger_commit"],"type":"object"},"input_kind":{"enum":["descriptive","inferential"],"type":"string"},"iterations":{"type":["integer","null"]},"null_model":{"type":"string"},"seed":{"type":["integer","null"]},"statistic":{"type":"string"},"test_id":{"type":"string"}},"required":["test_id","input_kind","frozen_transform_provenance","statistic","null_model"],"type":"object"},"type":"array"},"test_results":{"items":{"properties":{"effect":{"type":["string","null"]},"interpretation":{"type":"string"},"layer_state":{"description":"Evidence state of the claim at result time.","enum":["ATTESTED","RECONSTRUCTED","DERIVED","CANDIDATE","GENERATED","OMEGA"],"type":"string"},"outcome":{"$ref":"#/$defs/result_kind"},"p_value":{"type":["number","null"]},"statistic_value":{"type":["number","null"]},"test_id":{"type":"string"}},"required":["test_id","outcome","interpretation","layer_state"],"type":"object"},"type":"array"}},"required":["packet_id","produced_at","source_commit","pipeline","test_declarations","test_results","ledger_ref"],"title":"LiberLinteusResultPacket","type":"object"}